{
  "project_code": "OSS-BLIND-R4",
  "work_item_id": "RAILS-58429",
  "truth_source": "testcases/case_plan.json",
  "projection_only": true,
  "generated_from": [
    "testcases/case_plan.json",
    "testcases/testcases_main.md"
  ],
  "testpoints": [
    {
      "testpoint_id": "TP-001",
      "source_case_plan_id": "CP-001",
      "source_gate_ids": [
        "TG-001"
      ],
      "source_example_ids": [
        "AE-001"
      ],
      "source_responsibility_ids": [],
      "page_name": "BroadcastLogger 标签广播",
      "section_name": "多 Logger 标签上下文",
      "module_name": "BroadcastLogger tagged",
      "feature_name": "无 block 标签广播",
      "test_dimension": "field_rule",
      "test_point": "无 block 的 tagged 返回可继续记录日志的 BroadcastLogger",
      "assertion": "返回值是 BroadcastLogger，而不是 Array；可在返回值上继续调用日志方法。",
      "priority": "P0",
      "validation_path": "product_acceptance",
      "should_generate_case": true,
      "generated_testcase_ids": [
        "OSS-BLIND-R4-BROADCASTLOGGER-TAGGED-SERVER-FN-001"
      ]
    },
    {
      "testpoint_id": "TP-002",
      "source_case_plan_id": "CP-002",
      "source_gate_ids": [
        "TG-002"
      ],
      "source_example_ids": [
        "AE-002"
      ],
      "source_responsibility_ids": [],
      "page_name": "BroadcastLogger 标签广播",
      "section_name": "多 Logger 标签上下文",
      "module_name": "BroadcastLogger tagged",
      "feature_name": "无 block 标签广播",
      "test_dimension": "backend_job",
      "test_point": "无 block 的 tagged 为所有 tagging logger 应用标签",
      "assertion": "每个支持 `tagged` 的 logger 收到的消息都带有指定标签。",
      "priority": "P0",
      "validation_path": "product_acceptance",
      "should_generate_case": true,
      "generated_testcase_ids": [
        "OSS-BLIND-R4-BROADCASTLOGGER-TAGGED-SERVER-ST-001"
      ]
    },
    {
      "testpoint_id": "TP-003",
      "source_case_plan_id": "CP-003",
      "source_gate_ids": [
        "TG-003"
      ],
      "source_example_ids": [
        "AE-003"
      ],
      "source_responsibility_ids": [],
      "page_name": "BroadcastLogger 标签广播",
      "section_name": "多 Logger 标签上下文",
      "module_name": "BroadcastLogger tagged",
      "feature_name": "无 block 标签广播",
      "test_dimension": "backend_job",
      "test_point": "无 tagged 能力的广播目标仍被保留并接收日志",
      "assertion": "不支持 `tagged` 的 logger 仍存在于广播目标中；该 logger 收到后续日志消息。",
      "priority": "P0",
      "validation_path": "product_acceptance",
      "should_generate_case": true,
      "generated_testcase_ids": [
        "OSS-BLIND-R4-BROADCASTLOGGER-TAGGED-SERVER-ST-002"
      ]
    },
    {
      "testpoint_id": "TP-004",
      "source_case_plan_id": "CP-004",
      "source_gate_ids": [
        "TG-004"
      ],
      "source_example_ids": [
        "AE-004"
      ],
      "source_responsibility_ids": [],
      "page_name": "BroadcastLogger 标签广播",
      "section_name": "多 Logger 标签上下文",
      "module_name": "BroadcastLogger tagged",
      "feature_name": "Block 标签上下文",
      "test_dimension": "backend_job",
      "test_point": "有 block 的 tagged 只执行一次用户 block",
      "assertion": "用户 block 的执行次数等于一次。",
      "priority": "P0",
      "validation_path": "product_acceptance",
      "should_generate_case": true,
      "generated_testcase_ids": [
        "OSS-BLIND-R4-BROADCASTLOGGER-TAGGED-SERVER-ST-003"
      ]
    },
    {
      "testpoint_id": "TP-005",
      "source_case_plan_id": "CP-005",
      "source_gate_ids": [
        "TG-004"
      ],
      "source_example_ids": [
        "AE-005"
      ],
      "source_responsibility_ids": [],
      "page_name": "BroadcastLogger 标签广播",
      "section_name": "多 Logger 标签上下文",
      "module_name": "BroadcastLogger tagged",
      "feature_name": "Block 标签上下文",
      "test_dimension": "backend_job",
      "test_point": "有 block 时所有 tagging logger 同时激活标签",
      "assertion": "每个支持 `tagged` 的 logger 在该 block 执行期间收到带指定标签的消息。",
      "priority": "P0",
      "validation_path": "product_acceptance",
      "should_generate_case": true,
      "generated_testcase_ids": [
        "OSS-BLIND-R4-BROADCASTLOGGER-TAGGED-SERVER-ST-004"
      ]
    },
    {
      "testpoint_id": "TP-006",
      "source_case_plan_id": "CP-006",
      "source_gate_ids": [
        "TG-005"
      ],
      "source_example_ids": [
        "AE-006"
      ],
      "source_responsibility_ids": [],
      "page_name": "BroadcastLogger 标签广播",
      "section_name": "多 Logger 标签上下文",
      "module_name": "BroadcastLogger tagged",
      "feature_name": "Block 标签上下文",
      "test_dimension": "backend_job",
      "test_point": "tagged block 正常结束后清理临时标签",
      "assertion": "block 之后的日志不包含该临时标签。",
      "priority": "P0",
      "validation_path": "product_acceptance",
      "should_generate_case": true,
      "generated_testcase_ids": [
        "OSS-BLIND-R4-BROADCASTLOGGER-TAGGED-SERVER-ST-005"
      ]
    },
    {
      "testpoint_id": "TP-007",
      "source_case_plan_id": "CP-007",
      "source_gate_ids": [
        "TG-005"
      ],
      "source_example_ids": [
        "AE-007"
      ],
      "source_responsibility_ids": [],
      "page_name": "BroadcastLogger 标签广播",
      "section_name": "多 Logger 标签上下文",
      "module_name": "BroadcastLogger tagged",
      "feature_name": "Block 标签上下文",
      "test_dimension": "backend_job",
      "test_point": "tagged block 抛出异常后仍清理临时标签",
      "assertion": "异常之后的日志不包含该临时标签。",
      "priority": "P0",
      "validation_path": "product_acceptance",
      "should_generate_case": true,
      "generated_testcase_ids": [
        "OSS-BLIND-R4-BROADCASTLOGGER-TAGGED-SERVER-ST-006"
      ]
    },
    {
      "testpoint_id": "TP-008",
      "source_case_plan_id": "CP-008",
      "source_gate_ids": [
        "TG-005"
      ],
      "source_example_ids": [
        "AE-008"
      ],
      "source_responsibility_ids": [],
      "page_name": "BroadcastLogger 标签广播",
      "section_name": "多 Logger 标签上下文",
      "module_name": "BroadcastLogger tagged",
      "feature_name": "Block 标签上下文",
      "test_dimension": "field_rule",
      "test_point": "tagged block 的异常继续传播给调用方",
      "assertion": "调用方向外收到同一异常类型和消息；异常不被 BroadcastLogger 吞掉或替换。",
      "priority": "P0",
      "validation_path": "product_acceptance",
      "should_generate_case": true,
      "generated_testcase_ids": [
        "OSS-BLIND-R4-BROADCASTLOGGER-TAGGED-SERVER-FN-002"
      ]
    },
    {
      "testpoint_id": "TP-009",
      "source_case_plan_id": "CP-009",
      "source_gate_ids": [
        "TG-006"
      ],
      "source_example_ids": [
        "AE-009"
      ],
      "source_responsibility_ids": [],
      "page_name": "BroadcastLogger 标签广播",
      "section_name": "多 Logger 标签上下文",
      "module_name": "BroadcastLogger tagged",
      "feature_name": "无 block 标签广播",
      "test_dimension": "backend_job",
      "test_point": "按是否响应 tagged 决定标签处理参与者",
      "assertion": "只对响应 `tagged` 的目标调用标签处理；不响应 `tagged` 的目标不接收 `tagged` 调用。",
      "priority": "P1",
      "validation_path": "product_acceptance",
      "should_generate_case": true,
      "generated_testcase_ids": [
        "OSS-BLIND-R4-BROADCASTLOGGER-TAGGED-SERVER-ST-007"
      ]
    },
    {
      "testpoint_id": "TP-010",
      "source_case_plan_id": "CP-010",
      "source_gate_ids": [
        "TG-007"
      ],
      "source_example_ids": [
        "AE-010"
      ],
      "source_responsibility_ids": [],
      "page_name": "BroadcastLogger 标签广播",
      "section_name": "多 Logger 标签上下文",
      "module_name": "BroadcastLogger tagged",
      "feature_name": "无 block 标签广播",
      "test_dimension": "cross_surface_linkage",
      "test_point": "单 logger 标签与普通广播行为保持兼容",
      "assertion": "两条记录流程完成后，单 logger 收到带指定标签的消息；普通广播中的每个目标仍收到未被改变的消息。",
      "priority": "P0",
      "validation_path": "product_acceptance",
      "should_generate_case": true,
      "generated_testcase_ids": [
        "OSS-BLIND-R4-BROADCASTLOGGER-TAGGED-SERVER-FL-001"
      ]
    }
  ]
}
