{
  "project_code": "OSS-BLIND",
  "work_item_id": "SALEOR-19804",
  "truth_source": "testcases/case_plan.json",
  "projection_only": true,
  "generated_from": [
    "testcases/case_plan.json",
    "testcases/testcases_main.md"
  ],
  "testpoints": [
    {
      "testpoint_id": "TP-001",
      "source_case_plan_id": "CP-001",
      "source_gate_ids": [
        "TG-001"
      ],
      "source_example_ids": [
        "AE-001"
      ],
      "source_responsibility_ids": [],
      "page_name": "giftCardBulkCreate GraphQL 接口",
      "section_name": "批量创建请求",
      "module_name": "礼品卡批量创建",
      "feature_name": "批量礼品卡标签关系追加",
      "test_dimension": "cross_surface_linkage",
      "test_point": "复用已有标签时追加新礼品卡并保留历史成员",
      "assertion": "复用已有标签后，其成员集合包含历史礼品卡和当前批次礼品卡，历史关系不被移除。",
      "priority": "P0",
      "validation_path": "product_acceptance",
      "should_generate_case": true,
      "generated_testcase_ids": [
        "OSS-BLIND-GIFTCARDBULK-BULKCREATE-API-FL-001"
      ]
    },
    {
      "testpoint_id": "TP-002",
      "source_case_plan_id": "CP-002",
      "source_gate_ids": [
        "TG-002"
      ],
      "source_example_ids": [
        "AE-002"
      ],
      "source_responsibility_ids": [],
      "page_name": "giftCardBulkCreate GraphQL 接口",
      "section_name": "批量创建请求",
      "module_name": "礼品卡批量创建",
      "feature_name": "批量礼品卡标签关系追加",
      "test_dimension": "cross_surface_linkage",
      "test_point": "新标签创建后关联当前批次礼品卡",
      "assertion": "输入不存在的标签时创建该标签，并将本次成功创建的全部礼品卡关联到该标签。",
      "priority": "P1",
      "validation_path": "product_acceptance",
      "should_generate_case": true,
      "generated_testcase_ids": [
        "OSS-BLIND-GIFTCARDBULK-BULKCREATE-API-FL-002"
      ]
    },
    {
      "testpoint_id": "TP-003",
      "source_case_plan_id": "CP-003",
      "source_gate_ids": [
        "TG-003"
      ],
      "source_example_ids": [
        "AE-003"
      ],
      "source_responsibility_ids": [],
      "page_name": "giftCardBulkCreate GraphQL 接口",
      "section_name": "批量创建请求",
      "module_name": "礼品卡批量创建",
      "feature_name": "批量礼品卡标签关系追加",
      "test_dimension": "cross_surface_linkage",
      "test_point": "四个连续批次后标签成员集合等于批次并集",
      "assertion": "四批输入依次为 G1/G2-{red,blue}、G3/G4-{red,blue}、G5/G6-{blue,green}、G7/G8-{yellow}；最终 red、blue、green、yellow 成员集合分别精确等于 {G1-G4}、{G1-G6}、{G5,G6}、{G7,G8}。",
      "priority": "P0",
      "validation_path": "product_acceptance",
      "should_generate_case": true,
      "generated_testcase_ids": [
        "OSS-BLIND-GIFTCARDBULK-BULKCREATE-API-FL-003"
      ]
    },
    {
      "testpoint_id": "TP-004",
      "source_case_plan_id": "CP-004",
      "source_gate_ids": [
        "TG-004"
      ],
      "source_example_ids": [
        "AE-004"
      ],
      "source_responsibility_ids": [],
      "page_name": "giftCardBulkCreate GraphQL 接口",
      "section_name": "批量创建请求",
      "module_name": "礼品卡批量创建",
      "feature_name": "批量礼品卡标签关系追加",
      "test_dimension": "cross_surface_linkage",
      "test_point": "新旧标签混合输入只建立指定关系",
      "assertion": "当前批次礼品卡只获得输入指定的新旧标签，同时保留已有标签的历史成员关系。",
      "priority": "P0",
      "validation_path": "product_acceptance",
      "should_generate_case": true,
      "generated_testcase_ids": [
        "OSS-BLIND-GIFTCARDBULK-BULKCREATE-API-FL-004"
      ]
    },
    {
      "testpoint_id": "TP-005",
      "source_case_plan_id": "CP-005",
      "source_gate_ids": [
        "TG-005"
      ],
      "source_example_ids": [
        "AE-005"
      ],
      "source_responsibility_ids": [],
      "page_name": "giftCardBulkCreate GraphQL 接口",
      "section_name": "批量创建请求",
      "module_name": "礼品卡批量创建",
      "feature_name": "批量礼品卡标签关系追加",
      "test_dimension": "data_persistence",
      "test_point": "成功响应数量与实际新建礼品卡一致",
      "assertion": "响应 `count` 等于实际新建数量，`errors` 为空时才判定成功，标签结果符合既有接口契约。",
      "priority": "P0",
      "validation_path": "product_acceptance",
      "should_generate_case": true,
      "generated_testcase_ids": [
        "OSS-BLIND-GIFTCARDBULK-BULKCREATE-API-DV-005"
      ]
    },
    {
      "testpoint_id": "TP-006",
      "source_case_plan_id": "CP-006",
      "source_gate_ids": [
        "TG-007"
      ],
      "source_example_ids": [
        "AE-006"
      ],
      "source_responsibility_ids": [],
      "page_name": "giftCardBulkCreate GraphQL 接口",
      "section_name": "批量创建请求",
      "module_name": "礼品卡批量创建",
      "feature_name": "批量礼品卡标签关系追加",
      "test_dimension": "permission_scope",
      "test_point": "权限、非法输入及非批量礼品卡操作行为不回退",
      "assertion": "无权限与非法输入保持既有错误结果，`giftCardCreate` 和 `giftCardUpdate` 的成功及标签关系行为保持不变。",
      "priority": "P1",
      "validation_path": "product_acceptance",
      "should_generate_case": true,
      "generated_testcase_ids": [
        "OSS-BLIND-GIFTCARDBULK-BULKCREATE-API-PM-001"
      ]
    },
    {
      "testpoint_id": "TP-007",
      "source_case_plan_id": "CP-007",
      "source_gate_ids": [
        "TG-019"
      ],
      "source_example_ids": [
        "AE-007"
      ],
      "source_responsibility_ids": [],
      "page_name": "giftCardBulkCreate GraphQL 接口",
      "section_name": "批量创建请求",
      "module_name": "礼品卡批量创建",
      "feature_name": "批量礼品卡标签关系追加",
      "test_dimension": "cross_surface_linkage",
      "test_point": "已有标签大小写变体复用同一小写记录",
      "assertion": "已有 {vip} 时输入 {VIP} 复用同一标签，数据库仍只有一条名称为 {vip} 的记录。",
      "priority": "P0",
      "validation_path": "product_acceptance",
      "should_generate_case": true,
      "generated_testcase_ids": [
        "OSS-BLIND-GIFTCARDBULK-BULKCREATE-API-FL-005"
      ]
    },
    {
      "testpoint_id": "TP-008",
      "source_case_plan_id": "CP-008",
      "source_gate_ids": [
        "TG-019"
      ],
      "source_example_ids": [
        "AE-008"
      ],
      "source_responsibility_ids": [],
      "page_name": "giftCardBulkCreate GraphQL 接口",
      "section_name": "批量创建请求",
      "module_name": "礼品卡批量创建",
      "feature_name": "批量礼品卡标签关系追加",
      "test_dimension": "data_persistence",
      "test_point": "重复输入的新标签只创建一条小写记录",
      "assertion": "同一请求输入 {New,new,NEW} 后，数据库只新增一条名称为 {new} 的标签记录。",
      "priority": "P0",
      "validation_path": "product_acceptance",
      "should_generate_case": true,
      "generated_testcase_ids": [
        "OSS-BLIND-GIFTCARDBULK-BULKCREATE-API-DV-006"
      ]
    },
    {
      "testpoint_id": "TP-009",
      "source_case_plan_id": "CP-009",
      "source_gate_ids": [
        "TG-019"
      ],
      "source_example_ids": [
        "AE-009"
      ],
      "source_responsibility_ids": [],
      "page_name": "giftCardBulkCreate GraphQL 接口",
      "section_name": "批量创建请求",
      "module_name": "礼品卡批量创建",
      "feature_name": "批量礼品卡标签关系追加",
      "test_dimension": "cross_surface_linkage",
      "test_point": "大小写变体和重复标签只建立一次礼品卡关系",
      "assertion": "大小写变体或重复标签输入只为每张当前批次礼品卡建立一次归一标签关系。",
      "priority": "P0",
      "validation_path": "product_acceptance",
      "should_generate_case": true,
      "generated_testcase_ids": [
        "OSS-BLIND-GIFTCARDBULK-BULKCREATE-API-FL-007"
      ]
    }
  ]
}
